Reference,Reference Link,Reference Wikipedia,Organization Name,Organization Country,Organization Type,Organization Wikipedia,Organization Link
MIT OpenCourseWare Transportation Courses,https://ocw.mit.edu/courses/transportation-courses/,,Massachusetts Institute of Technology,USA,University,https://en.wikipedia.org/wiki/Massachusetts_Institute_of_Technology,https://web.mit.edu
Texas Trip Generation Manual,http://tti.tamu.edu/documents/0-6760-P1.pdf,,Texas A&M Transportation Institute,USA,University,,
Crash Modification Factors Clearinghouse,http://www.cmfclearinghouse.org,,University of North Carolina Highway Safety Research Center,USA,University,,
Journal of Transport and Land Use,https://www.jtlu.org/,https://en.wikipedia.org/wiki/Journal_of_Transport_and_Land_Use,University of Minnesota Center for Transportation Studies,USA,University,,
Understanding and Communicating Multimodal Transportation Data,http://web.cecs.pdx.edu/~monserec/t.data/,,Portland State University,USA,University,,
National Institute for Transportation and Communities,http://nitc.trec.pdx.edu/events/archive,,Portland State University Transportation Research and Education Center,USA,University,,http://nitc.trec.pdx.edu
